### ISSUE TITLE
Influx 0.9.3 not receiving from collectd

### ISSUE THREAD

**Issue by mjlyon** [influxdb/influxdb#4188]
Influxdb is up and running, and after setting the collectd listener to : enabled = true, the database was created automatically, but is not being fed.

I have updated the network configuration in collectd.conf:

<Plugin network>
 Server "127.0.0.1" "8096"
</Plugin>

**Comment by otoolep** [comment]
I suggest you upgrade to 0.9.4 and use all the stats available with that release (execute the query `SHOW STATISTICS`) to debug your setup.

**Comment by mjlyon** [comment]
Upgraded to 0.9.4; SHOW STATISTICS does not yield a successful return.  

Show measurements on the internal returns the expected tables, while on the collectd database (automatically created by Influx), it returns empty.

**Comment by otoolep** [comment]
Sorry it's SHOW STATS

**Comment by mjlyon** [comment]
engine
path:/var/opt/influxdb/data/_internal/monitor/1, version:bz1

blks_write	blks_write_bytes	blks_write_bytes_c	points_write	points_write_dedupe
11247	809271	734684	11247	11247
engine
path:/var/opt/influxdb/data/_internal/monitor/2, version:bz1

blks_write	blks_write_bytes	blks_write_bytes_c	points_write	points_write_dedupe
48516	3395592	3084027	48516	48516
httpd
bind::8086

query_req	query_resp_bytes	req
70	13868	70
shard
engine:bz1, id:1, path:/var/opt/influxdb/data/_internal/monitor/1

fields_create	series_create	write_points_ok	write_req
0	6	11241	1874
shard
engine:bz1, id:2, path:/var/opt/influxdb/data/_internal/monitor/2

fields_create	series_create	write_points_ok	write_req
40	9	48525	5392
wal
path:/var/opt/influxdb/wal/_internal/monitor/1

auto_flush	flush_duration	idle_flush	mem_size	meta_flush	points_flush	points_write	points_write_req	series_flush
72198	351.8524827640007	1874	0	121	11241	11241	1874	11241
wal
path:/var/opt/influxdb/wal/_internal/monitor/2

auto_flush	flush_duration	idle_flush	mem_size	meta_flush	points_flush	points_write	points_write_req	series_flush
52635	1033.3549727860043	5391	594	89	48516	48525	5392	48516
write
point_req	point_req_local	req	write_ok
59766	59766	7266	7266
runtime
Alloc	Frees	HeapAlloc	HeapIdle	HeapInUse	HeapObjects	HeapReleased	HeapSys	Lookups	Mallocs	NumGC	NumGoroutine	PauseTotalNs	Sys	TotalAlloc
2902792	12069690	2902792	5857280	3743744	9211	0	9601024	29205	12078901	648	40	357590843	13117688	1952538464

**Comment by otoolep** [comment]
The collectd input has not received a single bit of data. I suggest you
check your sender and the network connection between InfluxDB and the
sender.

**Comment by mjlyon** [comment]
[root@viz3 etc]# tcpdump -i lo -p -n dst port 8096
tcpdump: verbose output suppressed, use -v or -vv for full protocol decode
listening on lo, link-type EN10MB (Ethernet), capture size 65535 bytes
12:21:02.628817 IP 10.205.15.86.39117 > 10.205.15.86.8096: UDP, length 1333
12:21:12.628820 IP 10.205.15.86.39117 > 10.205.15.86.8096: UDP, length 1305
12:21:22.628806 IP 10.205.15.86.39117 > 10.205.15.86.8096: UDP, length 1345
12:21:32.628777 IP 10.205.15.86.39117 > 10.205.15.86.8096: UDP, length 1309

Locally, it is sending and communicating on the configured port for the collectd plugin within influxdb.conf and collectd.conf

**Comment by otoolep** [comment]
Please show us the log and the output of `ss -anu`.

**Comment by mjlyon** [comment]
I changed the ports from 8096 to 28596; seemed to fix the issue.

**Comment by otoolep** [comment]
Were your collectd clients sending on 8096?

**Comment by mjlyon** [comment]
Yes, they were set to 8096 for the network sender port.  Looking at open ports, didn't see any reason anything else would have been using it, but I may have missed it.
