### ISSUE TITLE
[0.9.2] Graphite plugin not closing connection and running out of file descriptors

### ISSUE THREAD

**Issue by tlopo** [influxdb/influxdb#3830]
I wrote a script to import data from influxdb-0.8.8 to influxdb-0.9.2 and it was running out of file descriptors I increased open files limit, but I am afraid it won't be enough:
```
[root@TIAGO-TEST1 test]# while true; do echo $(date) - $(lsof -nP  | grep influx | wc -l);sleep 60; done
Tue Aug 25 14:55:19 UTC 2015 - 482
Tue Aug 25 14:56:19 UTC 2015 - 557
Tue Aug 25 14:57:19 UTC 2015 - 633
Tue Aug 25 14:58:19 UTC 2015 - 708
Tue Aug 25 14:59:19 UTC 2015 - 784
...
Tue Aug 25 15:18:24 UTC 2015 - 2212
Tue Aug 25 15:19:24 UTC 2015 - 2288
Tue Aug 25 15:20:24 UTC 2015 - 2364
Tue Aug 25 15:21:25 UTC 2015 - 2439
Tue Aug 25 15:22:25 UTC 2015 - 2515
```
All connections are hanging on `CLOSE-WAIT` state: 

```
[root@TIAGO-TEST1 ~]# ss -ntp | grep influx | awk '{print $1}' | sort | uniq -c 
   2613 CLOSE-WAIT
```

To import the data I am sending several 1K lines file to netcat on port 2003, data is being imported well so far.
Version:
```
[root@TIAGO-TEST1 ~]# rpm -qa | grep influx
influxdb-0.9.2-1.x86_64
```

**Comment by pauldix** [comment]
You can't either re-use the connection or close out the connections? We can have timeouts on the TCP listener, but if the client is behaving badly (like in this case) then even then it's going to run out of fds.

**Comment by tlopo** [comment]
@pauldix  I am not sure the client is to blame, connections do not hang if I use netcat as dummy server:
 ```nc -l 2003 -k > /dev/null```

**Comment by bltb** [comment]
@tlopo, could you please share PCAP dumps of your two scenarios? Just TCP
handshakes and resets / closes will do. Thanks!

**Comment by tlopo** [comment]
Ok the pcap follows this pattern for both scenarios: 

```
11:37:48.815296 IP 127.0.0.1.59894 > 127.0.0.1.2003: Flags [S], seq 3821856350, win 43690, options [mss 65495,sackOK,TS val 1100742295 ecr 0,nop,wscale 7], length 0
11:37:48.815316 IP 127.0.0.1.2003 > 127.0.0.1.59894: Flags [S.], seq 2031023175, ack 3821856351, win 43690, options [mss 65495,sackOK,TS val 1100742295 ecr 1100742295,nop,wscale 7], length 0
11:37:48.824248 IP 127.0.0.1.59894 > 127.0.0.1.2003: Flags [FP.], seq 24577:66190, ack 1, win 342, options [nop,nop,TS val 1100742298 ecr 1100742296], length 41613
11:37:48.835674 IP 127.0.0.1.59894 > 127.0.0.1.2003: Flags [FP.], seq 24577:66190, ack 1, win 342, options [nop,nop,TS val 1100742301 ecr 1100742296], length 41613
```
But I found the culprit, in one of my testes I have set idle timeout to 0, so although the client was sending the FIN packet it was not waiting for the FIN-ACK before creating a new connection, The dummy server worked fine because there was no idle timeout as it was not processing data.

I will re-use the connection as Paul suggested. Thanks for your help!
